{
  "vessel_id": "msc-meraviglia",
  "vessel_name": "MSC Meraviglia",
  "provenance": {
    "source_artifact": "UNSOURCED_LEGACY_STAGING (Pending Builder Specification Artifact)",
    "verification_authority": "UNVERIFIED",
    "sha256": "0000000000000000000000000000000000000000000000000000000000000000",
    "last_audited": "2026-08-19"
  },
  "technical_specifications": {
    "class": "Meraviglia-class (Vista Project Lead Ship)",
    "sister_ships": [
      "MSC Bellissima"
    ],
    "imo_number": 9760512,
    "mmsi": 249774000,
    "call_sign": "9HA4431",
    "builder": "Chantiers de l'Atlantique (STX France, Saint-Nazaire)",
    "cost_to_build": {
      "usd": 950000000,
      "eur": 700000000
    },
    "key_milestones": {
      "steel_cutting": "2014-03-20",
      "launch_date": "2016-09-02",
      "maiden_voyage": "2017-06-04"
    },
    "port_of_registry": "Valletta, Malta",
    "flag_state": "Malta",
    "tonnage_gt": 171598,
    "dimensions": {
      "length_meters": 315.83,
      "length_feet": 1036,
      "beam_meters": 43.0,
      "beam_feet": 141.0,
      "draft_meters": 8.75,
      "draft_feet_inches": "28 ft 8 in"
    },
    "propulsion_and_power": {
      "propulsion_type": "2 × ABB Azipod propulsion units",
      "installed_power_kw": 38400,
      "installed_power_hp": 51500,
      "cruising_speed_knots": 21.8,
      "max_speed_knots": 22.7
    },
    "capacities": {
      "total_decks": 18,
      "passenger_accessible_decks": 15,
      "passenger_capacity_double_occupancy": 4488,
      "passenger_capacity_max_occupancy": 5714,
      "crew_capacity_min": 1536,
      "crew_capacity_max": 1595,
      "total_cabins_min": 2214,
      "total_cabins_max": 2214,
      "balcony_cabin_percentage": 75
    },
    "connectivity_and_smart_systems": {
      "satellite_network": "Starlink High-Speed Maritime Internet",
      "iot_wearables": "Near Field Communication (NFC) smart wristbands"
    },
    "environmental_features": {
      "scrubber_fitted": true,
      "advanced_wastewater_treatment": "AWT compliant with IMO MARPOL Annex IV",
      "shore_power_connectivity": true
    }
  }
}